{
  "receipt_id": "RCP-WORK-VF-05D-d17833395934",
  "receipt_type": "work",
  "task_id": "VF-05D",
  "capsule_id": "CAP-VF-05D",
  "capsule_revision": 1,
  "capsule_digest": "sha256:37206965e45bf7cbbd117e3c56f213754153018066701b45f6e12b8c12773e64",
  "diff_digest": "sha256:5d3fd6d066c998d6ee291af2cf78aafa07251b80f5003b4139c15b6e03ea7708",
  "assigned_role": "AGT-DATA",
  "risk_class": "high",
  "base_commit": "315d1ce9895dd542d4713e9aeb07ce04d3883396",
  "head_commit": "d17833395934839777a22d91bc51e55bc0b97637",
  "target_ref": "origin/main",
  "target_sha": "68b79c0b61e6f2044229d8d41ee291cfabb42373",
  "stale_context": false,
  "gate_profile_id": "DATA_KERNEL_P0",
  "gate_profile_digest": "sha256:e940897cd69faa57946a4f983a9b4029ee72602a918a61d63a9c6df32688c39c",
  "gate_result": "passed",
  "gate_stages": [
    {
      "stage": 1,
      "name": "Architecture Fitness & Boundaries",
      "command": [
        "python3",
        "scripts/check_architecture_fitness.py"
      ],
      "cwd": "/Users/hrygo/Documents/wom-worktrees/feat-vf-05d-fork-carries-evidence",
      "exit_code": 0,
      "status": "passed",
      "started_at": "2026-09-29T18:04:06.233911+00:00",
      "finished_at": "2026-09-29T18:04:06.271754+00:00",
      "raw_log_digest": "sha256:97c7c92686fb5ba1bb59727a3f240f0ec903b65e3464ed3e04e577acc0908627",
      "note": ""
    },
    {
      "stage": 2,
      "name": "Data Kernel Unit Tests",
      "command": [
        "uv",
        "run",
        "--locked",
        "--extra",
        "dev",
        "pytest",
        "-q",
        "-k",
        "database or outbox or migration"
      ],
      "cwd": "/Users/hrygo/Documents/wom-worktrees/feat-vf-05d-fork-carries-evidence/engine",
      "exit_code": 0,
      "status": "passed",
      "started_at": "2026-09-29T18:04:06.271845+00:00",
      "finished_at": "2026-09-29T18:04:09.464350+00:00",
      "raw_log_digest": "sha256:89d014b428b446c78dbc011bae683a870fd077f1e5b7afc73269fc727735b98c",
      "note": ""
    }
  ],
  "coverage_gaps": [],
  "scope_audit": {
    "changed_files": [
      "engine/infrastructure/voice_binding_repository.py",
      "engine/tests/test_voice_binding_repository.py"
    ],
    "violations": [],
    "escalations": [],
    "privileged_uses": []
  },
  "toolchain": {
    "python": "3.14.7",
    "uv": "uv 0.12.18 (Homebrew 2026-09-22 aarch64-apple-darwin)",
    "swift": "Apple Swift version 6.4 (swiftlang-6.4.0.34.1 clang-2100.3.34.1)",
    "engine_uv_lock_digest": "sha256:fddfb2d7170dd500db490ab633e1aad875fd54881aa80a5b4a4967f4723e3441"
  },
  "runner": {
    "host": "HRYGO-AI-STUDIO",
    "user": "hrygo",
    "role": "AGT-DATA",
    "cwd": "/Users/hrygo/Documents/wom-worktrees/feat-vf-05d-fork-carries-evidence"
  },
  "started_at": "2026-09-29T18:04:06.179235+00:00",
  "finished_at": "2026-09-29T18:04:09.577686+00:00",
  "verdict": "passed",
  "merge_authorizing": false,
  "merge": {},
  "notes": [],
  "integrity": {
    "digest_algorithm": "sha256",
    "statement": "本凭单为可复算摘要记录（digest-recorded receipt），不是密码学签名；其可信度由受保护分支策略、CODEOWNERS 评审与 CI 复算共同保证。"
  }
}
