{
  "receipt_id": "RCP-INTEGRATION-VF-65-67503f8df6bb",
  "receipt_type": "integration",
  "task_id": "VF-65",
  "capsule_id": "CAP-VF-65",
  "capsule_revision": 1,
  "capsule_digest": "sha256:b695a4165f778c790048abc521f9428d13d7b8c80e6d95d0adc5be0c650671d5",
  "diff_digest": "sha256:cb3d7f260d95e32555f63edad0d6bfd825adeb5f3c60a1c443d3c8769644d4b7",
  "assigned_role": "AGT-QA",
  "risk_class": "high",
  "base_commit": "7a7b0b47a8438168e35c5ad3d06854ac8e90a558",
  "head_commit": "67503f8df6bb6fdd4bfcbd8c6f797b63d4d345a1",
  "target_ref": "main",
  "target_sha": "67503f8df6bb6fdd4bfcbd8c6f797b63d4d345a1",
  "stale_context": false,
  "gate_profile_id": "FULL_P0",
  "gate_profile_digest": "sha256:7aee88d64a790cf32dedf224fd100ce4d623c8a92a5f7ee06703783decccfee6",
  "gate_result": "passed",
  "gate_stages": [
    {
      "stage": 1,
      "name": "Architecture Fitness & Boundaries",
      "command": [
        "python3",
        "scripts/check_architecture_fitness.py"
      ],
      "cwd": "/Users/hrygo/Documents/wom-worktrees/feat-per-speaker-voice-coverage",
      "exit_code": 0,
      "status": "passed",
      "started_at": "2026-09-30T20:43:24.820092+00:00",
      "finished_at": "2026-09-30T20:43:24.855503+00:00",
      "raw_log_digest": "sha256:97c7c92686fb5ba1bb59727a3f240f0ec903b65e3464ed3e04e577acc0908627",
      "note": ""
    },
    {
      "stage": 2,
      "name": "Python Engine & Contracts Test Suite",
      "command": [
        "uv",
        "run",
        "--locked",
        "--extra",
        "dev",
        "pytest",
        "-q"
      ],
      "cwd": "/Users/hrygo/Documents/wom-worktrees/feat-per-speaker-voice-coverage/engine",
      "exit_code": 0,
      "status": "passed",
      "started_at": "2026-09-30T20:43:24.855575+00:00",
      "finished_at": "2026-09-30T20:45:17.100300+00:00",
      "raw_log_digest": "sha256:ca5e96a49195cccd41f0ac64e975f9a0f0ce0ecc4d024d0854b4fc82cd4b95ae",
      "note": ""
    },
    {
      "stage": 3,
      "name": "Swift 6 macOS App & Protocol Tests",
      "command": [
        "swift",
        "test",
        "--scratch-path",
        "/Users/hrygo/Documents/wom-worktrees/feat-per-speaker-voice-coverage/.hacf/spm-scratch"
      ],
      "cwd": "/Users/hrygo/Documents/wom-worktrees/feat-per-speaker-voice-coverage/macos-app",
      "exit_code": 0,
      "status": "passed",
      "started_at": "2026-09-30T20:45:17.100390+00:00",
      "finished_at": "2026-09-30T20:45:40.124271+00:00",
      "raw_log_digest": "sha256:33d6dfb8ba33db39795cab14744c9feb53facfada0416a446fc2df98b49f77f8",
      "note": ""
    },
    {
      "stage": 4,
      "name": "Xcode App Target Build (默认 MainActor 隔离编译验证)",
      "command": [
        "xcodebuild",
        "-project",
        "WorldOfMysteries.xcodeproj",
        "-scheme",
        "WorldOfMysteries",
        "-configuration",
        "Debug",
        "-destination",
        "platform=macOS,arch=arm64",
        "-derivedDataPath",
        "../.hacf/run/xcode-derived",
        "build"
      ],
      "cwd": "/Users/hrygo/Documents/wom-worktrees/feat-per-speaker-voice-coverage/macos-app",
      "exit_code": 0,
      "status": "passed",
      "started_at": "2026-09-30T20:45:40.124472+00:00",
      "finished_at": "2026-09-30T20:45:41.870482+00:00",
      "raw_log_digest": "sha256:1efc0d15acac7acd080cfb37f889fd4d3012433386557c63570618037c9110c2",
      "note": ""
    }
  ],
  "coverage_gaps": [],
  "scope_audit": {
    "changed_files": [
      ".agents/capsules/VF-65.json",
      ".agents/receipts/VF-65/15b904852838.json",
      "engine/tests/test_speech_unit.py"
    ],
    "violations": [],
    "escalations": [],
    "privileged_uses": []
  },
  "toolchain": {
    "python": "3.14.7",
    "uv": "uv 0.12.18 (Homebrew 2026-09-22 aarch64-apple-darwin)",
    "swift": "Apple Swift version 6.4 (swiftlang-6.4.0.34.1 clang-2100.3.34.1)",
    "engine_uv_lock_digest": "sha256:fddfb2d7170dd500db490ab633e1aad875fd54881aa80a5b4a4967f4723e3441"
  },
  "runner": {
    "host": "HRYGO-AI-STUDIO",
    "user": "hrygo",
    "role": "AGT-QA",
    "cwd": "/Users/hrygo/Documents/WorldofMysteries"
  },
  "started_at": "2026-09-30T20:43:24.819898+00:00",
  "finished_at": "2026-09-30T20:47:59.575320+00:00",
  "verdict": "passed",
  "merge_authorizing": true,
  "merge": {
    "strategy": "fast-forward",
    "expected_main_sha": "7a7b0b47a8438168e35c5ad3d06854ac8e90a558",
    "merged_sha": "67503f8df6bb6fdd4bfcbd8c6f797b63d4d345a1",
    "cas_verified": true,
    "post_merge_smoke": "passed"
  },
  "notes": [],
  "integrity": {
    "digest_algorithm": "sha256",
    "statement": "本凭单为可复算摘要记录（digest-recorded receipt），不是密码学签名；其可信度由受保护分支策略、CODEOWNERS 评审与 CI 复算共同保证。"
  }
}
