{
  "receipt_id": "RCP-INTEGRATION-VF-83D-08e9fb0fbfa1",
  "receipt_type": "integration",
  "task_id": "VF-83D",
  "capsule_id": "CAP-VF-83D",
  "capsule_revision": 1,
  "capsule_digest": "sha256:88292ee3dbf37263995613f3e0666e1f69ab1b71d92a19642ba99ddc52d8b9f2",
  "diff_digest": "sha256:28f99e5453ec2cef529b02993f5c7613cc47a171c55c57b326ea1eda8c64f130",
  "assigned_role": "AGT-AI",
  "risk_class": "high",
  "base_commit": "dd0343b426aeb85e32cd50ed46194508254f9f30",
  "head_commit": "08e9fb0fbfa1d3373c9ea50eacb40a938104b412",
  "target_ref": "main",
  "target_sha": "08e9fb0fbfa1d3373c9ea50eacb40a938104b412",
  "stale_context": false,
  "gate_profile_id": "FULL_P0",
  "gate_profile_digest": "sha256:7aee88d64a790cf32dedf224fd100ce4d623c8a92a5f7ee06703783decccfee6",
  "gate_result": "passed",
  "gate_stages": [
    {
      "stage": 1,
      "name": "Architecture Fitness & Boundaries",
      "command": [
        "python3",
        "scripts/check_architecture_fitness.py"
      ],
      "cwd": "/Users/hrygo/Documents/wom-worktrees/feat-vf-83d-drop-legacy-speech",
      "exit_code": 0,
      "status": "passed",
      "started_at": "2026-10-01T11:16:57.148091+00:00",
      "finished_at": "2026-10-01T11:16:57.189186+00:00",
      "raw_log_digest": "sha256:97c7c92686fb5ba1bb59727a3f240f0ec903b65e3464ed3e04e577acc0908627",
      "note": ""
    },
    {
      "stage": 2,
      "name": "Python Engine & Contracts Test Suite",
      "command": [
        "uv",
        "run",
        "--locked",
        "--extra",
        "dev",
        "pytest",
        "-q"
      ],
      "cwd": "/Users/hrygo/Documents/wom-worktrees/feat-vf-83d-drop-legacy-speech/engine",
      "exit_code": 0,
      "status": "passed",
      "started_at": "2026-10-01T11:16:57.189273+00:00",
      "finished_at": "2026-10-01T11:19:03.986934+00:00",
      "raw_log_digest": "sha256:f19731d54100023a5f096002bf15959476be04cd0d0e9bf5f705f3feee5a5fb1",
      "note": ""
    },
    {
      "stage": 3,
      "name": "Swift 6 macOS App & Protocol Tests",
      "command": [
        "swift",
        "test",
        "--scratch-path",
        "/Users/hrygo/Documents/wom-worktrees/feat-vf-83d-drop-legacy-speech/.hacf/spm-scratch"
      ],
      "cwd": "/Users/hrygo/Documents/wom-worktrees/feat-vf-83d-drop-legacy-speech/macos-app",
      "exit_code": 0,
      "status": "passed",
      "started_at": "2026-10-01T11:19:03.987018+00:00",
      "finished_at": "2026-10-01T11:19:34.474106+00:00",
      "raw_log_digest": "sha256:279a760cde02b7378b37281ca40138ec90cd69ce9945649ac6b39d8a91b2578d",
      "note": ""
    },
    {
      "stage": 4,
      "name": "Xcode App Target Build (默认 MainActor 隔离编译验证)",
      "command": [
        "xcodebuild",
        "-project",
        "WorldOfMysteries.xcodeproj",
        "-scheme",
        "WorldOfMysteries",
        "-configuration",
        "Debug",
        "-destination",
        "platform=macOS,arch=arm64",
        "-derivedDataPath",
        "../.hacf/run/xcode-derived",
        "build"
      ],
      "cwd": "/Users/hrygo/Documents/wom-worktrees/feat-vf-83d-drop-legacy-speech/macos-app",
      "exit_code": 0,
      "status": "passed",
      "started_at": "2026-10-01T11:19:34.474224+00:00",
      "finished_at": "2026-10-01T11:19:36.884591+00:00",
      "raw_log_digest": "sha256:11c412a5e4595ed5941aad8ea1a69a9bfe3556163b76ff3cae5eb262f7efcd51",
      "note": ""
    }
  ],
  "coverage_gaps": [],
  "scope_audit": {
    "changed_files": [
      ".agents/receipts/VF-83D/cf6adbe20e0a.json",
      "engine/application/narrative_publication.py",
      "engine/tests/test_narrative_publication.py",
      "engine/tests/test_story_runtime.py"
    ],
    "violations": [],
    "escalations": [],
    "privileged_uses": []
  },
  "toolchain": {
    "python": "3.14.7",
    "uv": "uv 0.12.18 (Homebrew 2026-09-22 aarch64-apple-darwin)",
    "swift": "Apple Swift version 6.4 (swiftlang-6.4.0.34.1 clang-2100.3.34.1)",
    "engine_uv_lock_digest": "sha256:fddfb2d7170dd500db490ab633e1aad875fd54881aa80a5b4a4967f4723e3441"
  },
  "runner": {
    "host": "HRYGO-AI-STUDIO",
    "user": "hrygo",
    "role": "AGT-AI",
    "cwd": "/Users/hrygo/Documents/WorldofMysteries"
  },
  "started_at": "2026-10-01T11:16:57.147855+00:00",
  "finished_at": "2026-10-01T11:22:07.412523+00:00",
  "verdict": "passed",
  "merge_authorizing": true,
  "merge": {
    "strategy": "fast-forward",
    "expected_main_sha": "dd0343b426aeb85e32cd50ed46194508254f9f30",
    "merged_sha": "08e9fb0fbfa1d3373c9ea50eacb40a938104b412",
    "cas_verified": true,
    "post_merge_smoke": "passed"
  },
  "notes": [],
  "integrity": {
    "digest_algorithm": "sha256",
    "statement": "本凭单为可复算摘要记录（digest-recorded receipt），不是密码学签名；其可信度由受保护分支策略、CODEOWNERS 评审与 CI 复算共同保证。"
  }
}
