{
  "receipt_id": "RCP-WORK-VOICE-V06-DUPLEX-AEC-c4968dd0c7b0",
  "receipt_type": "work",
  "task_id": "VOICE-V06-DUPLEX-AEC",
  "capsule_id": "CAP-VOICE-V06-DUPLEX-AEC",
  "capsule_revision": 1,
  "capsule_digest": "sha256:01071948a1f9972cd1391625b24108171c6f13f62df9b5839db9b3dc2af61b99",
  "diff_digest": "sha256:26cf3d1275000d0ba645f590885dc854a6f2e6859f346cc4369fb961687654ef",
  "assigned_role": "AGT-MAC",
  "risk_class": "high",
  "base_commit": "563aca61475618c81f593db939bfe111409f6451",
  "head_commit": "c4968dd0c7b00892c796f1b9e4e6635e2bf53906",
  "target_ref": "origin/main",
  "target_sha": "563aca61475618c81f593db939bfe111409f6451",
  "stale_context": false,
  "gate_profile_id": "FULL_P0",
  "gate_profile_digest": "sha256:7aee88d64a790cf32dedf224fd100ce4d623c8a92a5f7ee06703783decccfee6",
  "gate_result": "passed",
  "gate_stages": [
    {
      "stage": 1,
      "name": "Architecture Fitness & Boundaries",
      "command": [
        "python3",
        "scripts/check_architecture_fitness.py"
      ],
      "cwd": "/Users/runner/work/WorldofMysteries/WorldofMysteries",
      "exit_code": 0,
      "status": "passed",
      "started_at": "2026-09-24T17:04:03.803320+00:00",
      "finished_at": "2026-09-24T17:04:03.877913+00:00",
      "raw_log_digest": "sha256:97c7c92686fb5ba1bb59727a3f240f0ec903b65e3464ed3e04e577acc0908627",
      "note": ""
    },
    {
      "stage": 2,
      "name": "Python Engine & Contracts Test Suite",
      "command": [
        "uv",
        "run",
        "--locked",
        "--extra",
        "dev",
        "pytest",
        "-q"
      ],
      "cwd": "/Users/runner/work/WorldofMysteries/WorldofMysteries/engine",
      "exit_code": 0,
      "status": "passed",
      "started_at": "2026-09-24T17:04:03.878054+00:00",
      "finished_at": "2026-09-24T17:05:35.024471+00:00",
      "raw_log_digest": "sha256:7cf02b82334dcf0836786f41c32c48097df2aacb183964fdbf6e366a0293f4c7",
      "note": ""
    },
    {
      "stage": 3,
      "name": "Swift 6 macOS App & Protocol Tests",
      "command": [
        "swift",
        "test",
        "--scratch-path",
        ".build"
      ],
      "cwd": "/Users/runner/work/WorldofMysteries/WorldofMysteries/macos-app",
      "exit_code": 0,
      "status": "passed",
      "started_at": "2026-09-24T17:05:35.025628+00:00",
      "finished_at": "2026-09-24T17:08:31.257685+00:00",
      "raw_log_digest": "sha256:f5ca68a1b6bebe8860472869ff2551828eb969c8af5d384541f39f5642b8a3d7",
      "note": ""
    },
    {
      "stage": 4,
      "name": "Xcode App Target Build (默认 MainActor 隔离编译验证)",
      "command": [
        "xcodebuild",
        "-project",
        "WorldOfMysteries.xcodeproj",
        "-scheme",
        "WorldOfMysteries",
        "-configuration",
        "Debug",
        "-destination",
        "platform=macOS,arch=arm64",
        "-derivedDataPath",
        "../.hacf/run/xcode-derived",
        "build"
      ],
      "cwd": "/Users/runner/work/WorldofMysteries/WorldofMysteries/macos-app",
      "exit_code": 0,
      "status": "passed",
      "started_at": "2026-09-24T17:08:31.259014+00:00",
      "finished_at": "2026-09-24T17:09:47.839921+00:00",
      "raw_log_digest": "sha256:9554e414ea9d14b5ef0a20b1e2c0431eaec37d2682e6f546cd96dfcaf95bb09a",
      "note": ""
    }
  ],
  "coverage_gaps": [],
  "scope_audit": {
    "changed_files": [
      "macos-app/WorldOfMysteries/Media/VoiceInputPTTSession.swift",
      "macos-app/WorldOfMysteries/Media/VoiceProcessingDuplexGraph.swift",
      "macos-app/WorldOfMysteriesTests/MicrophoneCaptureTests.swift",
      "macos-app/WorldOfMysteriesTests/VoiceInputPTTSessionTests.swift"
    ],
    "violations": [],
    "escalations": [],
    "privileged_uses": []
  },
  "toolchain": {
    "python": "3.14.7",
    "uv": "uv 0.12.18 (01cb90c1a 2026-09-22 aarch64-apple-darwin)",
    "swift": "Apple Swift version 6.3.3 (swiftlang-6.3.3.1.3 clang-2100.1.1.101)",
    "engine_uv_lock_digest": "sha256:fddfb2d7170dd500db490ab633e1aad875fd54881aa80a5b4a4967f4723e3441"
  },
  "runner": {
    "host": "sjc20-bb661-e49cc817-888f-4768-b8b0-063295cc3b47-C27C64711DC7.local",
    "user": "runner",
    "role": "AGT-MAC",
    "cwd": "/Users/runner/work/WorldofMysteries/WorldofMysteries"
  },
  "started_at": "2026-09-24T17:04:03.441653+00:00",
  "finished_at": "2026-09-24T17:09:50.292616+00:00",
  "verdict": "passed",
  "merge_authorizing": false,
  "merge": {},
  "notes": [],
  "integrity": {
    "digest_algorithm": "sha256",
    "statement": "本凭单为可复算摘要记录（digest-recorded receipt），不是密码学签名；其可信度由受保护分支策略、CODEOWNERS 评审与 CI 复算共同保证。"
  }
}
