{
  "receipt_id": "RCP-WORK-AO-03-EPISODE-IDEM-6c3199693dd2",
  "receipt_type": "work",
  "task_id": "AO-03-EPISODE-IDEM",
  "capsule_id": "CAP-AO-03-EPISODE-IDEM",
  "capsule_revision": 1,
  "capsule_digest": "sha256:87311eebad87aaf8fe4be249189da8266a0021423aceb5f52d68766b688fdd28",
  "diff_digest": "sha256:2b8d17dd7bc9208c147e5b713119852c51f2211ed3606a0b200c975ab3030ee7",
  "assigned_role": "AGT-AI",
  "risk_class": "high",
  "base_commit": "c62b41ab8f5308ff50696a3bf9022d44772d39a6",
  "head_commit": "6c3199693dd2e618489a759594ea0041153b77f1",
  "target_ref": "origin/main",
  "target_sha": "c62b41ab8f5308ff50696a3bf9022d44772d39a6",
  "stale_context": false,
  "gate_profile_id": "AI_GATEWAY_P0",
  "gate_profile_digest": "sha256:afd00e18003069ea384a524153feb08b15be7dad74a0d641493bf93653e8694c",
  "gate_result": "passed",
  "gate_stages": [
    {
      "stage": 1,
      "name": "Architecture Fitness & Boundaries",
      "command": [
        "python3",
        "scripts/check_architecture_fitness.py"
      ],
      "cwd": "/Users/hrygo/Documents/wom-worktrees/feat-ao-03-episode-idem-v2",
      "exit_code": 0,
      "status": "passed",
      "started_at": "2026-09-28T11:12:21.989446+00:00",
      "finished_at": "2026-09-28T11:12:22.025044+00:00",
      "raw_log_digest": "sha256:97c7c92686fb5ba1bb59727a3f240f0ec903b65e3464ed3e04e577acc0908627",
      "note": ""
    },
    {
      "stage": 2,
      "name": "AI Gateway & Context Compiler Unit Tests",
      "command": [
        "uv",
        "run",
        "--locked",
        "--extra",
        "dev",
        "pytest",
        "-q",
        "-k",
        "ai or gateway or context or proposal"
      ],
      "cwd": "/Users/hrygo/Documents/wom-worktrees/feat-ao-03-episode-idem-v2/engine",
      "exit_code": 0,
      "status": "passed",
      "started_at": "2026-09-28T11:12:22.025126+00:00",
      "finished_at": "2026-09-28T11:12:41.462652+00:00",
      "raw_log_digest": "sha256:32e22114382f1efa3c7f952f3a207d4b2afb44bf55cf83710ee00658b504fdb2",
      "note": ""
    }
  ],
  "coverage_gaps": [],
  "scope_audit": {
    "changed_files": [
      "engine/infrastructure/episode_settlement.py",
      "engine/tests/test_golden_five_turn_application.py"
    ],
    "violations": [],
    "escalations": [],
    "privileged_uses": []
  },
  "toolchain": {
    "python": "3.14.7",
    "uv": "uv 0.12.18 (Homebrew 2026-09-22 aarch64-apple-darwin)",
    "swift": "Apple Swift version 6.4 (swiftlang-6.4.0.34.1 clang-2100.3.34.1)",
    "engine_uv_lock_digest": "sha256:fddfb2d7170dd500db490ab633e1aad875fd54881aa80a5b4a4967f4723e3441"
  },
  "runner": {
    "host": "HRYGO-AI-STUDIO",
    "user": "hrygo",
    "role": "AGT-AI",
    "cwd": "/Users/hrygo/Documents/wom-worktrees/feat-ao-03-episode-idem-v2"
  },
  "started_at": "2026-09-28T11:12:21.955723+00:00",
  "finished_at": "2026-09-28T11:12:41.578819+00:00",
  "verdict": "passed",
  "merge_authorizing": false,
  "merge": {},
  "notes": [],
  "integrity": {
    "digest_algorithm": "sha256",
    "statement": "本凭单为可复算摘要记录（digest-recorded receipt），不是密码学签名；其可信度由受保护分支策略、CODEOWNERS 评审与 CI 复算共同保证。"
  }
}
