{
  "receipt_id": "RCP-WORK-VF-119-76ec98cca064",
  "receipt_type": "work",
  "task_id": "VF-119",
  "capsule_id": "CAP-VF-119",
  "capsule_revision": 1,
  "capsule_digest": "sha256:caf56565bea3fc6af22a97f60bf3de438b5db3b4997fd3c9bde27c7831c3af9c",
  "diff_digest": "sha256:c3b365808bdaa543fd0c3f8107788b1d774f04a918200216468908ad90052188",
  "assigned_role": "AGT-ARB",
  "risk_class": "privileged",
  "base_commit": "cc45bcf7ced678483fb7836614f37590f5be2ed4",
  "head_commit": "76ec98cca0644452295ceac1dc46981b9463248e",
  "target_ref": "origin/main",
  "target_sha": "74af835f83f1ec6bc9f449b9b17d250935cd3c7a",
  "stale_context": false,
  "gate_profile_id": "FULL_P0",
  "gate_profile_digest": "sha256:7aee88d64a790cf32dedf224fd100ce4d623c8a92a5f7ee06703783decccfee6",
  "gate_result": "passed",
  "gate_stages": [
    {
      "stage": 1,
      "name": "Architecture Fitness & Boundaries",
      "command": [
        "python3",
        "scripts/check_architecture_fitness.py"
      ],
      "cwd": "/Users/hrygo/Documents/wom-worktrees/docs-vf-119-script-test-ownership",
      "exit_code": 0,
      "status": "passed",
      "started_at": "2026-10-02T08:20:14.077492+00:00",
      "finished_at": "2026-10-02T08:20:14.114045+00:00",
      "raw_log_digest": "sha256:97c7c92686fb5ba1bb59727a3f240f0ec903b65e3464ed3e04e577acc0908627",
      "note": ""
    },
    {
      "stage": 2,
      "name": "Python Engine & Contracts Test Suite",
      "command": [
        "uv",
        "run",
        "--locked",
        "--extra",
        "dev",
        "pytest",
        "-q"
      ],
      "cwd": "/Users/hrygo/Documents/wom-worktrees/docs-vf-119-script-test-ownership/engine",
      "exit_code": 0,
      "status": "passed",
      "started_at": "2026-10-02T08:20:14.114124+00:00",
      "finished_at": "2026-10-02T08:22:10.537939+00:00",
      "raw_log_digest": "sha256:ed01f7ac73305e7e00bcb17bb10a380fbbfca5cc3575f10aadbd1cdeb79ce884",
      "note": ""
    },
    {
      "stage": 3,
      "name": "Swift 6 macOS App & Protocol Tests",
      "command": [
        "swift",
        "test",
        "--scratch-path",
        "/Users/hrygo/Documents/wom-worktrees/docs-vf-119-script-test-ownership/.hacf/spm-scratch"
      ],
      "cwd": "/Users/hrygo/Documents/wom-worktrees/docs-vf-119-script-test-ownership/macos-app",
      "exit_code": 0,
      "status": "passed",
      "started_at": "2026-10-02T08:22:10.538024+00:00",
      "finished_at": "2026-10-02T08:22:34.384079+00:00",
      "raw_log_digest": "sha256:00fb8451053dd05cd4aae22b9ec820391b19881cf55a2a2996775266242e727f",
      "note": ""
    },
    {
      "stage": 4,
      "name": "Xcode App Target Build (默认 MainActor 隔离编译验证)",
      "command": [
        "xcodebuild",
        "-project",
        "WorldOfMysteries.xcodeproj",
        "-scheme",
        "WorldOfMysteries",
        "-configuration",
        "Debug",
        "-destination",
        "platform=macOS,arch=arm64",
        "-derivedDataPath",
        "../.hacf/run/xcode-derived",
        "build"
      ],
      "cwd": "/Users/hrygo/Documents/wom-worktrees/docs-vf-119-script-test-ownership/macos-app",
      "exit_code": 0,
      "status": "passed",
      "started_at": "2026-10-02T08:22:34.384178+00:00",
      "finished_at": "2026-10-02T08:22:36.280428+00:00",
      "raw_log_digest": "sha256:1f36cf8bd465b821ef50cc8e5e4b9078b53e87e9feeeb43919c317b4d569630a",
      "note": ""
    }
  ],
  "coverage_gaps": [],
  "scope_audit": {
    "changed_files": [
      "docs/06_实施基线/2026-10-02_ADR005_逐项验收报告_V01-V12.md"
    ],
    "violations": [],
    "escalations": [],
    "privileged_uses": []
  },
  "toolchain": {
    "python": "3.14.7",
    "uv": "uv 0.12.18 (Homebrew 2026-09-22 aarch64-apple-darwin)",
    "swift": "Apple Swift version 6.4 (swiftlang-6.4.0.34.1 clang-2100.3.34.1)",
    "engine_uv_lock_digest": "sha256:fddfb2d7170dd500db490ab633e1aad875fd54881aa80a5b4a4967f4723e3441"
  },
  "runner": {
    "host": "HRYGO-AI-STUDIO",
    "user": "hrygo",
    "role": "AGT-ARB",
    "cwd": "/Users/hrygo/Documents/wom-worktrees/docs-vf-119-script-test-ownership"
  },
  "started_at": "2026-10-02T08:20:14.041763+00:00",
  "finished_at": "2026-10-02T08:22:36.389479+00:00",
  "verdict": "passed",
  "merge_authorizing": false,
  "merge": {},
  "notes": [],
  "integrity": {
    "digest_algorithm": "sha256",
    "statement": "本凭单为可复算摘要记录（digest-recorded receipt），不是密码学签名；其可信度由受保护分支策略、CODEOWNERS 评审与 CI 复算共同保证。"
  }
}
