{
  "receipt_id": "RCP-INTEGRATION-VF-80D-3594048d6e4b",
  "receipt_type": "integration",
  "task_id": "VF-80D",
  "capsule_id": "CAP-VF-80D",
  "capsule_revision": 1,
  "capsule_digest": "sha256:474dfcbe25af8d3b8ba1c991f53536bd0a6ba6a56a15a4e51f447042afe15081",
  "diff_digest": "sha256:e9bc14d0c20cb5b759b251a993a79e7fc38cdc17534e314695c2e05f39fbda58",
  "assigned_role": "AGT-DATA",
  "risk_class": "high",
  "base_commit": "9666001fca2d05b8642f6f32ccf0d8b318fe144e",
  "head_commit": "3594048d6e4b8a0bd99184615f032be84e4d57bb",
  "target_ref": "main",
  "target_sha": "3594048d6e4b8a0bd99184615f032be84e4d57bb",
  "stale_context": false,
  "gate_profile_id": "FULL_P0",
  "gate_profile_digest": "sha256:7aee88d64a790cf32dedf224fd100ce4d623c8a92a5f7ee06703783decccfee6",
  "gate_result": "passed",
  "gate_stages": [
    {
      "stage": 1,
      "name": "Architecture Fitness & Boundaries",
      "command": [
        "python3",
        "scripts/check_architecture_fitness.py"
      ],
      "cwd": "/Users/hrygo/Documents/wom-worktrees/feat-vf-80d-scene-roster-evidence",
      "exit_code": 0,
      "status": "passed",
      "started_at": "2026-10-01T02:23:50.978613+00:00",
      "finished_at": "2026-10-01T02:23:51.016191+00:00",
      "raw_log_digest": "sha256:97c7c92686fb5ba1bb59727a3f240f0ec903b65e3464ed3e04e577acc0908627",
      "note": ""
    },
    {
      "stage": 2,
      "name": "Python Engine & Contracts Test Suite",
      "command": [
        "uv",
        "run",
        "--locked",
        "--extra",
        "dev",
        "pytest",
        "-q"
      ],
      "cwd": "/Users/hrygo/Documents/wom-worktrees/feat-vf-80d-scene-roster-evidence/engine",
      "exit_code": 0,
      "status": "passed",
      "started_at": "2026-10-01T02:23:51.016283+00:00",
      "finished_at": "2026-10-01T02:25:51.082804+00:00",
      "raw_log_digest": "sha256:fa0334e314b691fa6258622156e104d1c0e5cab5b04bbdc823db3e4a01663418",
      "note": ""
    },
    {
      "stage": 3,
      "name": "Swift 6 macOS App & Protocol Tests",
      "command": [
        "swift",
        "test",
        "--scratch-path",
        "/Users/hrygo/Documents/wom-worktrees/feat-vf-80d-scene-roster-evidence/.hacf/spm-scratch"
      ],
      "cwd": "/Users/hrygo/Documents/wom-worktrees/feat-vf-80d-scene-roster-evidence/macos-app",
      "exit_code": 0,
      "status": "passed",
      "started_at": "2026-10-01T02:25:51.082927+00:00",
      "finished_at": "2026-10-01T02:26:15.279690+00:00",
      "raw_log_digest": "sha256:9a50b8be575d14349b1b1f2993ee1a05538cf6a1a50cc1480df648cf942c06d2",
      "note": ""
    },
    {
      "stage": 4,
      "name": "Xcode App Target Build (默认 MainActor 隔离编译验证)",
      "command": [
        "xcodebuild",
        "-project",
        "WorldOfMysteries.xcodeproj",
        "-scheme",
        "WorldOfMysteries",
        "-configuration",
        "Debug",
        "-destination",
        "platform=macOS,arch=arm64",
        "-derivedDataPath",
        "../.hacf/run/xcode-derived",
        "build"
      ],
      "cwd": "/Users/hrygo/Documents/wom-worktrees/feat-vf-80d-scene-roster-evidence/macos-app",
      "exit_code": 0,
      "status": "passed",
      "started_at": "2026-10-01T02:26:15.279790+00:00",
      "finished_at": "2026-10-01T02:26:17.328327+00:00",
      "raw_log_digest": "sha256:6dea1f4c2aab114fab336f55751e6ca0c5ff2845f9e60508e9dd1ac074f4a605",
      "note": ""
    }
  ],
  "coverage_gaps": [],
  "scope_audit": {
    "changed_files": [
      ".agents/receipts/VF-80D/0a3c21e0bb2f.json",
      "engine/infrastructure/gameplay_context_repository.py",
      "engine/tests/test_gameplay_context_state_layer.py"
    ],
    "violations": [],
    "escalations": [],
    "privileged_uses": []
  },
  "toolchain": {
    "python": "3.14.7",
    "uv": "uv 0.12.18 (Homebrew 2026-09-22 aarch64-apple-darwin)",
    "swift": "Apple Swift version 6.4 (swiftlang-6.4.0.34.1 clang-2100.3.34.1)",
    "engine_uv_lock_digest": "sha256:fddfb2d7170dd500db490ab633e1aad875fd54881aa80a5b4a4967f4723e3441"
  },
  "runner": {
    "host": "HRYGO-AI-STUDIO",
    "user": "hrygo",
    "role": "AGT-DATA",
    "cwd": "/Users/hrygo/Documents/WorldofMysteries"
  },
  "started_at": "2026-10-01T02:23:50.978401+00:00",
  "finished_at": "2026-10-01T02:28:43.506277+00:00",
  "verdict": "passed",
  "merge_authorizing": true,
  "merge": {
    "strategy": "fast-forward",
    "expected_main_sha": "9666001fca2d05b8642f6f32ccf0d8b318fe144e",
    "merged_sha": "3594048d6e4b8a0bd99184615f032be84e4d57bb",
    "cas_verified": true,
    "post_merge_smoke": "passed"
  },
  "notes": [],
  "integrity": {
    "digest_algorithm": "sha256",
    "statement": "本凭单为可复算摘要记录（digest-recorded receipt），不是密码学签名；其可信度由受保护分支策略、CODEOWNERS 评审与 CI 复算共同保证。"
  }
}
