{
  "receipt_id": "RCP-INTEGRATION-VF-84C-5efdb877cc6f",
  "receipt_type": "integration",
  "task_id": "VF-84C",
  "capsule_id": "CAP-VF-84C",
  "capsule_revision": 1,
  "capsule_digest": "sha256:6fda2cbc01008bf18b3392db05b9cb396a0d56b5e7f68b0ed1abbe6c19a38d4a",
  "diff_digest": "sha256:377cedb2caa4d17f57b8f61bff60b9f0f6d3225040cb885053c41960f7f4db13",
  "assigned_role": "AGT-MAC",
  "risk_class": "medium",
  "base_commit": "43e1f5b66ec8958166414e47ffad14d4e9a58024",
  "head_commit": "5efdb877cc6fbcbaeb259ffe5192da3cdb204be0",
  "target_ref": "main",
  "target_sha": "5efdb877cc6fbcbaeb259ffe5192da3cdb204be0",
  "stale_context": false,
  "gate_profile_id": "FULL_P0",
  "gate_profile_digest": "sha256:7aee88d64a790cf32dedf224fd100ce4d623c8a92a5f7ee06703783decccfee6",
  "gate_result": "passed",
  "gate_stages": [
    {
      "stage": 1,
      "name": "Architecture Fitness & Boundaries",
      "command": [
        "python3",
        "scripts/check_architecture_fitness.py"
      ],
      "cwd": "/Users/hrygo/Documents/wom-worktrees/feat-vf-84c-app-plays-every-segment",
      "exit_code": 0,
      "status": "passed",
      "started_at": "2026-10-01T12:31:58.619412+00:00",
      "finished_at": "2026-10-01T12:31:58.660250+00:00",
      "raw_log_digest": "sha256:97c7c92686fb5ba1bb59727a3f240f0ec903b65e3464ed3e04e577acc0908627",
      "note": ""
    },
    {
      "stage": 2,
      "name": "Python Engine & Contracts Test Suite",
      "command": [
        "uv",
        "run",
        "--locked",
        "--extra",
        "dev",
        "pytest",
        "-q"
      ],
      "cwd": "/Users/hrygo/Documents/wom-worktrees/feat-vf-84c-app-plays-every-segment/engine",
      "exit_code": 0,
      "status": "passed",
      "started_at": "2026-10-01T12:31:58.660357+00:00",
      "finished_at": "2026-10-01T12:34:04.403748+00:00",
      "raw_log_digest": "sha256:4eb7ff0f253d3bb835d37378c573c5e9734d55493db2e481379c26e36be3de37",
      "note": ""
    },
    {
      "stage": 3,
      "name": "Swift 6 macOS App & Protocol Tests",
      "command": [
        "swift",
        "test",
        "--scratch-path",
        "/Users/hrygo/Documents/wom-worktrees/feat-vf-84c-app-plays-every-segment/.hacf/spm-scratch"
      ],
      "cwd": "/Users/hrygo/Documents/wom-worktrees/feat-vf-84c-app-plays-every-segment/macos-app",
      "exit_code": 0,
      "status": "passed",
      "started_at": "2026-10-01T12:34:04.403866+00:00",
      "finished_at": "2026-10-01T12:34:28.654807+00:00",
      "raw_log_digest": "sha256:26542997937fad3fd8e6fe62bac881dd01da85ec0695dec68bc995e0ebeb3229",
      "note": ""
    },
    {
      "stage": 4,
      "name": "Xcode App Target Build (默认 MainActor 隔离编译验证)",
      "command": [
        "xcodebuild",
        "-project",
        "WorldOfMysteries.xcodeproj",
        "-scheme",
        "WorldOfMysteries",
        "-configuration",
        "Debug",
        "-destination",
        "platform=macOS,arch=arm64",
        "-derivedDataPath",
        "../.hacf/run/xcode-derived",
        "build"
      ],
      "cwd": "/Users/hrygo/Documents/wom-worktrees/feat-vf-84c-app-plays-every-segment/macos-app",
      "exit_code": 0,
      "status": "passed",
      "started_at": "2026-10-01T12:34:28.655041+00:00",
      "finished_at": "2026-10-01T12:34:30.655945+00:00",
      "raw_log_digest": "sha256:8bcd1a9fed928fc26c6ac5e98f1f2b16453ea8221f6bf22e8943b396403a8f48",
      "note": ""
    }
  ],
  "coverage_gaps": [],
  "scope_audit": {
    "changed_files": [
      ".agents/receipts/VF-84C/dad3ce2ddeb3.json",
      "macos-app/WorldOfMysteries/Media/VoiceTurnController.swift",
      "macos-app/WorldOfMysteries/StorySessionControl.swift",
      "macos-app/WorldOfMysteries/StorySessionPanel.swift",
      "macos-app/WorldOfMysteriesTests/VoiceTurnControllerTests.swift"
    ],
    "violations": [],
    "escalations": [],
    "privileged_uses": []
  },
  "toolchain": {
    "python": "3.14.7",
    "uv": "uv 0.12.18 (Homebrew 2026-09-22 aarch64-apple-darwin)",
    "swift": "Apple Swift version 6.4 (swiftlang-6.4.0.34.1 clang-2100.3.34.1)",
    "engine_uv_lock_digest": "sha256:fddfb2d7170dd500db490ab633e1aad875fd54881aa80a5b4a4967f4723e3441"
  },
  "runner": {
    "host": "HRYGO-AI-STUDIO",
    "user": "hrygo",
    "role": "AGT-MAC",
    "cwd": "/Users/hrygo/Documents/WorldofMysteries"
  },
  "started_at": "2026-10-01T12:31:58.619204+00:00",
  "finished_at": "2026-10-01T12:37:28.928085+00:00",
  "verdict": "passed",
  "merge_authorizing": true,
  "merge": {
    "strategy": "fast-forward",
    "expected_main_sha": "43e1f5b66ec8958166414e47ffad14d4e9a58024",
    "merged_sha": "5efdb877cc6fbcbaeb259ffe5192da3cdb204be0",
    "cas_verified": true,
    "post_merge_smoke": "passed"
  },
  "notes": [],
  "integrity": {
    "digest_algorithm": "sha256",
    "statement": "本凭单为可复算摘要记录（digest-recorded receipt），不是密码学签名；其可信度由受保护分支策略、CODEOWNERS 评审与 CI 复算共同保证。"
  }
}
