{
  "receipt_id": "RCP-WORK-VF-17-d997f3c6d483",
  "receipt_type": "work",
  "task_id": "VF-17",
  "capsule_id": "CAP-VF-17",
  "capsule_revision": 1,
  "capsule_digest": "sha256:1452674ee9aca152ecc2fa76040ff36badc5077b6a3439a03b51cdb21a985411",
  "diff_digest": "sha256:4cc5a46febdc37f9262c25e2b1737b9c9872617b910026a534689c1b788cb662",
  "assigned_role": "AGT-AI",
  "risk_class": "high",
  "base_commit": "b88b9028caaf484fa6504b5799ecb11fc6bbfb87",
  "head_commit": "d997f3c6d483a71e85a8c53b9dc6d493480d40dd",
  "target_ref": "origin/main",
  "target_sha": "68b79c0b61e6f2044229d8d41ee291cfabb42373",
  "stale_context": false,
  "gate_profile_id": "AI_GATEWAY_P0",
  "gate_profile_digest": "sha256:afd00e18003069ea384a524153feb08b15be7dad74a0d641493bf93653e8694c",
  "gate_result": "passed",
  "gate_stages": [
    {
      "stage": 1,
      "name": "Architecture Fitness & Boundaries",
      "command": [
        "python3",
        "scripts/check_architecture_fitness.py"
      ],
      "cwd": "/Users/hrygo/Documents/wom-worktrees/feat-vf-17-explicit-validation-steps",
      "exit_code": 0,
      "status": "passed",
      "started_at": "2026-09-30T00:38:53.898487+00:00",
      "finished_at": "2026-09-30T00:38:53.941139+00:00",
      "raw_log_digest": "sha256:97c7c92686fb5ba1bb59727a3f240f0ec903b65e3464ed3e04e577acc0908627",
      "note": ""
    },
    {
      "stage": 2,
      "name": "AI Gateway & Context Compiler Unit Tests",
      "command": [
        "uv",
        "run",
        "--locked",
        "--extra",
        "dev",
        "pytest",
        "-q",
        "-k",
        "ai or gateway or context or proposal"
      ],
      "cwd": "/Users/hrygo/Documents/wom-worktrees/feat-vf-17-explicit-validation-steps/engine",
      "exit_code": 0,
      "status": "passed",
      "started_at": "2026-09-30T00:38:53.941266+00:00",
      "finished_at": "2026-09-30T00:39:20.334373+00:00",
      "raw_log_digest": "sha256:dbee1791d8bcdfd237745a29f4ea3a4f9b6837cbac929e86e43eac756651d5f1",
      "note": ""
    }
  ],
  "coverage_gaps": [],
  "scope_audit": {
    "changed_files": [
      "engine/application/voice_foundry.py",
      "engine/tests/test_voice_foundry_worker.py"
    ],
    "violations": [],
    "escalations": [],
    "privileged_uses": []
  },
  "toolchain": {
    "python": "3.14.7",
    "uv": "uv 0.12.18 (Homebrew 2026-09-22 aarch64-apple-darwin)",
    "swift": "Apple Swift version 6.4 (swiftlang-6.4.0.34.1 clang-2100.3.34.1)",
    "engine_uv_lock_digest": "sha256:fddfb2d7170dd500db490ab633e1aad875fd54881aa80a5b4a4967f4723e3441"
  },
  "runner": {
    "host": "HRYGO-AI-STUDIO",
    "user": "hrygo",
    "role": "AGT-AI",
    "cwd": "/Users/hrygo/Documents/wom-worktrees/feat-vf-17-explicit-validation-steps"
  },
  "started_at": "2026-09-30T00:38:53.853497+00:00",
  "finished_at": "2026-09-30T00:39:20.466526+00:00",
  "verdict": "passed",
  "merge_authorizing": false,
  "merge": {},
  "notes": [],
  "integrity": {
    "digest_algorithm": "sha256",
    "statement": "本凭单为可复算摘要记录（digest-recorded receipt），不是密码学签名；其可信度由受保护分支策略、CODEOWNERS 评审与 CI 复算共同保证。"
  }
}
