{
  "receipt_id": "RCP-WORK-VOICE-V08-STORYBOOK-TRACKS-4eac018364af",
  "receipt_type": "work",
  "task_id": "VOICE-V08-STORYBOOK-TRACKS",
  "capsule_id": "CAP-VOICE-V08-STORYBOOK-TRACKS",
  "capsule_revision": 1,
  "capsule_digest": "sha256:7508d84343229e780a37b62cee26503ac0f619048417c8e9ecf15f92427869a0",
  "diff_digest": "sha256:9be768d0c9051f6098da724d2432bb278bf1b1d22c2d64a0f70374f0130acba6",
  "assigned_role": "AGT-DATA",
  "risk_class": "high",
  "base_commit": "e17ad1601ee86716eea6e31d9354c1b6d4ba65f4",
  "head_commit": "4eac018364af9dd7c92773304a75596a6aaa4c55",
  "target_ref": "origin/main",
  "target_sha": "e17ad1601ee86716eea6e31d9354c1b6d4ba65f4",
  "stale_context": false,
  "gate_profile_id": "FULL_P0",
  "gate_profile_digest": "sha256:7aee88d64a790cf32dedf224fd100ce4d623c8a92a5f7ee06703783decccfee6",
  "gate_result": "passed",
  "gate_stages": [
    {
      "stage": 1,
      "name": "Architecture Fitness & Boundaries",
      "command": [
        "python3",
        "scripts/check_architecture_fitness.py"
      ],
      "cwd": "/Users/runner/work/WorldofMysteries/WorldofMysteries",
      "exit_code": 0,
      "status": "passed",
      "started_at": "2026-09-25T02:33:39.874702+00:00",
      "finished_at": "2026-09-25T02:33:39.936165+00:00",
      "raw_log_digest": "sha256:97c7c92686fb5ba1bb59727a3f240f0ec903b65e3464ed3e04e577acc0908627",
      "note": ""
    },
    {
      "stage": 2,
      "name": "Python Engine & Contracts Test Suite",
      "command": [
        "uv",
        "run",
        "--locked",
        "--extra",
        "dev",
        "pytest",
        "-q"
      ],
      "cwd": "/Users/runner/work/WorldofMysteries/WorldofMysteries/engine",
      "exit_code": 0,
      "status": "passed",
      "started_at": "2026-09-25T02:33:39.936312+00:00",
      "finished_at": "2026-09-25T02:34:56.303015+00:00",
      "raw_log_digest": "sha256:620405836b22da52e561b309ffbf6fbe73db17ddf472fa6f8ed00a0db9872113",
      "note": ""
    },
    {
      "stage": 3,
      "name": "Swift 6 macOS App & Protocol Tests",
      "command": [
        "swift",
        "test",
        "--scratch-path",
        ".build"
      ],
      "cwd": "/Users/runner/work/WorldofMysteries/WorldofMysteries/macos-app",
      "exit_code": 0,
      "status": "passed",
      "started_at": "2026-09-25T02:34:56.303516+00:00",
      "finished_at": "2026-09-25T02:37:37.632983+00:00",
      "raw_log_digest": "sha256:fa576e12437245f2907bd5712311f6e663a7676d5af61c25b7cbd0b787f85835",
      "note": ""
    },
    {
      "stage": 4,
      "name": "Xcode App Target Build (默认 MainActor 隔离编译验证)",
      "command": [
        "xcodebuild",
        "-project",
        "WorldOfMysteries.xcodeproj",
        "-scheme",
        "WorldOfMysteries",
        "-configuration",
        "Debug",
        "-destination",
        "platform=macOS,arch=arm64",
        "-derivedDataPath",
        "../.hacf/run/xcode-derived",
        "build"
      ],
      "cwd": "/Users/runner/work/WorldofMysteries/WorldofMysteries/macos-app",
      "exit_code": 0,
      "status": "passed",
      "started_at": "2026-09-25T02:37:37.634865+00:00",
      "finished_at": "2026-09-25T02:38:36.070988+00:00",
      "raw_log_digest": "sha256:2fd3c617161d6b26441e06190535164173369669962252a0fb5a20b37d6a6965",
      "note": ""
    }
  ],
  "coverage_gaps": [],
  "scope_audit": {
    "changed_files": [
      "engine/infrastructure/audio_track_repository.py",
      "engine/infrastructure/database_manager.py",
      "engine/infrastructure/database_schema.py",
      "engine/infrastructure/migrations/007_world_audio_tracks.sql",
      "engine/tests/test_audio_track_repository.py",
      "engine/tests/test_story_session_migration.py"
    ],
    "violations": [],
    "escalations": [],
    "privileged_uses": [
      "engine/infrastructure/migrations/007_world_audio_tracks.sql"
    ]
  },
  "toolchain": {
    "python": "3.14.7",
    "uv": "uv 0.12.19 (bea138450 2026-09-24 aarch64-apple-darwin)",
    "swift": "Apple Swift version 6.3.3 (swiftlang-6.3.3.1.3 clang-2100.1.1.101)",
    "engine_uv_lock_digest": "sha256:fddfb2d7170dd500db490ab633e1aad875fd54881aa80a5b4a4967f4723e3441"
  },
  "runner": {
    "host": "sat12-dp149-5a34d629-4d1e-43e1-a07c-73d810b83ddb-B65AD8A73F32.local",
    "user": "runner",
    "role": "AGT-DATA",
    "cwd": "/Users/runner/work/WorldofMysteries/WorldofMysteries"
  },
  "started_at": "2026-09-25T02:33:39.014152+00:00",
  "finished_at": "2026-09-25T02:38:37.875203+00:00",
  "verdict": "passed",
  "merge_authorizing": false,
  "merge": {},
  "notes": [],
  "integrity": {
    "digest_algorithm": "sha256",
    "statement": "本凭单为可复算摘要记录（digest-recorded receipt），不是密码学签名；其可信度由受保护分支策略、CODEOWNERS 评审与 CI 复算共同保证。"
  }
}
