{
  "receipt_id": "RCP-WORK-VF-72L-589b1b052483",
  "receipt_type": "work",
  "task_id": "VF-72L",
  "capsule_id": "CAP-VF-72L",
  "capsule_revision": 1,
  "capsule_digest": "sha256:da88c57e555b3a673313903c51b06f59fe1b4b935f5c5008115057dcf5dc3cd1",
  "diff_digest": "sha256:d5a3a4c4d1a82415dddcab103d3dea79d0439db32dbba322581dcf44270066f7",
  "assigned_role": "AGT-AI",
  "risk_class": "high",
  "base_commit": "2b5e99e00c36e6a65cc88eae6af22252d527ebad",
  "head_commit": "589b1b0524831bf552eb6935bc0d87abb7fdec6c",
  "target_ref": "origin/main",
  "target_sha": "68b79c0b61e6f2044229d8d41ee291cfabb42373",
  "stale_context": false,
  "gate_profile_id": "AI_GATEWAY_P0",
  "gate_profile_digest": "sha256:afd00e18003069ea384a524153feb08b15be7dad74a0d641493bf93653e8694c",
  "gate_result": "passed",
  "gate_stages": [
    {
      "stage": 1,
      "name": "Architecture Fitness & Boundaries",
      "command": [
        "python3",
        "scripts/check_architecture_fitness.py"
      ],
      "cwd": "/Users/hrygo/Documents/wom-worktrees/feat-provider-locale-identity",
      "exit_code": 0,
      "status": "passed",
      "started_at": "2026-09-30T23:32:41.994179+00:00",
      "finished_at": "2026-09-30T23:32:42.032262+00:00",
      "raw_log_digest": "sha256:97c7c92686fb5ba1bb59727a3f240f0ec903b65e3464ed3e04e577acc0908627",
      "note": ""
    },
    {
      "stage": 2,
      "name": "AI Gateway & Context Compiler Unit Tests",
      "command": [
        "uv",
        "run",
        "--locked",
        "--extra",
        "dev",
        "pytest",
        "-q",
        "-k",
        "ai or gateway or context or proposal"
      ],
      "cwd": "/Users/hrygo/Documents/wom-worktrees/feat-provider-locale-identity/engine",
      "exit_code": 0,
      "status": "passed",
      "started_at": "2026-09-30T23:32:42.032358+00:00",
      "finished_at": "2026-09-30T23:33:08.742225+00:00",
      "raw_log_digest": "sha256:6beaa9a4a94fe851ddd13b3b7cb0ef3ecd2ce4cfd804d9a2b01a156c4c53a368",
      "note": ""
    }
  ],
  "coverage_gaps": [],
  "scope_audit": {
    "changed_files": [
      "engine/application/voice_evidence.py",
      "engine/application/voice_foundry_ports.py",
      "engine/infrastructure/scenarios/post_commit_handlers.py",
      "engine/infrastructure/story_runtime.py",
      "engine/tests/test_voice_evidence.py",
      "engine/tests/test_voice_foundry_worker.py"
    ],
    "violations": [],
    "escalations": [],
    "privileged_uses": []
  },
  "toolchain": {
    "python": "3.14.7",
    "uv": "uv 0.12.18 (Homebrew 2026-09-22 aarch64-apple-darwin)",
    "swift": "Apple Swift version 6.4 (swiftlang-6.4.0.34.1 clang-2100.3.34.1)",
    "engine_uv_lock_digest": "sha256:fddfb2d7170dd500db490ab633e1aad875fd54881aa80a5b4a4967f4723e3441"
  },
  "runner": {
    "host": "HRYGO-AI-STUDIO",
    "user": "hrygo",
    "role": "AGT-AI",
    "cwd": "/Users/hrygo/Documents/wom-worktrees/feat-provider-locale-identity"
  },
  "started_at": "2026-09-30T23:32:41.955564+00:00",
  "finished_at": "2026-09-30T23:33:08.881589+00:00",
  "verdict": "passed",
  "merge_authorizing": false,
  "merge": {},
  "notes": [],
  "integrity": {
    "digest_algorithm": "sha256",
    "statement": "本凭单为可复算摘要记录（digest-recorded receipt），不是密码学签名；其可信度由受保护分支策略、CODEOWNERS 评审与 CI 复算共同保证。"
  }
}
