{
  "receipt_id": "RCP-WORK-ART-ARTIFACT-OBJECT-FINISHING-R1-ab92c1e20c63",
  "receipt_type": "work",
  "task_id": "ART-ARTIFACT-OBJECT-FINISHING-R1",
  "capsule_id": "CAP-ART-ARTIFACT-OBJECT-FINISHING-R1",
  "capsule_revision": 1,
  "capsule_digest": "sha256:43bd018555e3340a5f9dfede2b291699d6d17cd5bf369e3088d70f2d38847b79",
  "diff_digest": "sha256:cef516c42182c12851fcbebf926a84993fa75f708908c7c6a64e3d1a8ce50de0",
  "assigned_role": "AGT-MAC",
  "risk_class": "medium",
  "base_commit": "8ff231a0c04edbaf8baa6406d87565611fb88ab6",
  "head_commit": "ab92c1e20c63efe1e14b35ec994339820c71f9aa",
  "target_ref": "main",
  "target_sha": "8ff231a0c04edbaf8baa6406d87565611fb88ab6",
  "stale_context": false,
  "gate_profile_id": "MACOS_APP_P0",
  "gate_profile_digest": "sha256:7de7135b5f5fbc8caf808b12c134028c9390b69a554abdc449019b1bde671893",
  "gate_result": "passed",
  "gate_stages": [
    {
      "stage": 1,
      "name": "Architecture Fitness & Boundaries",
      "command": [
        "python3",
        "scripts/check_architecture_fitness.py"
      ],
      "cwd": "/Users/hrygo/Documents/wom-worktrees/feat-artifact-object-finishing-r1",
      "exit_code": 0,
      "status": "passed",
      "started_at": "2026-09-18T17:33:26.814083+00:00",
      "finished_at": "2026-09-18T17:33:26.840614+00:00",
      "raw_log_digest": "sha256:97c7c92686fb5ba1bb59727a3f240f0ec903b65e3464ed3e04e577acc0908627",
      "note": ""
    },
    {
      "stage": 2,
      "name": "Swift 6 App & Protocol Tests",
      "command": [
        "swift",
        "test",
        "--scratch-path",
        "/Users/hrygo/Documents/wom-worktrees/feat-artifact-object-finishing-r1/.hacf/spm-scratch"
      ],
      "cwd": "/Users/hrygo/Documents/wom-worktrees/feat-artifact-object-finishing-r1/macos-app",
      "exit_code": 0,
      "status": "passed",
      "started_at": "2026-09-18T17:33:26.840685+00:00",
      "finished_at": "2026-09-18T17:33:29.640588+00:00",
      "raw_log_digest": "sha256:bab4bce8ceb8f9b0abf76aba34817d7c2427204b904842c3449357554f19483c",
      "note": ""
    },
    {
      "stage": 3,
      "name": "Xcode App Target Build (默认 MainActor 隔离编译验证)",
      "command": [
        "xcodebuild",
        "-project",
        "WorldOfMysteries.xcodeproj",
        "-scheme",
        "WorldOfMysteries",
        "-configuration",
        "Debug",
        "-destination",
        "platform=macOS,arch=arm64",
        "-derivedDataPath",
        "../.hacf/run/xcode-derived",
        "build"
      ],
      "cwd": "/Users/hrygo/Documents/wom-worktrees/feat-artifact-object-finishing-r1/macos-app",
      "exit_code": 0,
      "status": "passed",
      "started_at": "2026-09-18T17:33:29.640802+00:00",
      "finished_at": "2026-09-18T17:33:31.528455+00:00",
      "raw_log_digest": "sha256:c79f7705df32dd56151a83631f9ca1d5401a4b19adddfe2599f90b7bc9c1a94d",
      "note": ""
    }
  ],
  "coverage_gaps": [],
  "scope_audit": {
    "changed_files": [],
    "violations": [],
    "escalations": [],
    "privileged_uses": []
  },
  "toolchain": {
    "python": "3.14.7",
    "uv": "uv 0.12.15 (Homebrew 2026-09-15 aarch64-apple-darwin)",
    "swift": "Apple Swift version 6.4 (swiftlang-6.4.0.34.1 clang-2100.3.34.1)",
    "engine_uv_lock_digest": "sha256:fddfb2d7170dd500db490ab633e1aad875fd54881aa80a5b4a4967f4723e3441"
  },
  "runner": {
    "host": "HRYGO-AI-STUDIO",
    "user": "hrygo",
    "role": "AGT-MAC",
    "cwd": "/Users/hrygo/Documents/wom-worktrees/feat-artifact-object-finishing-r1"
  },
  "started_at": "2026-09-18T17:33:26.786480+00:00",
  "finished_at": "2026-09-18T17:33:32.146925+00:00",
  "verdict": "passed",
  "merge_authorizing": false,
  "merge": {},
  "notes": [],
  "integrity": {
    "digest_algorithm": "sha256",
    "statement": "本凭单为可复算摘要记录（digest-recorded receipt），不是密码学签名；其可信度由受保护分支策略、CODEOWNERS 评审与 CI 复算共同保证。"
  }
}
