{
  "receipt_id": "RCP-WORK-VF-04B-74b08b200c5d",
  "receipt_type": "work",
  "task_id": "VF-04B",
  "capsule_id": "CAP-VF-04B",
  "capsule_revision": 1,
  "capsule_digest": "sha256:bf064de0d922b86118aef03d570d4a8a98fea455bff810c7eebaab832f2889de",
  "diff_digest": "sha256:0812c4143a8f48f99180684230f10a852294c19e0917fdb35aa9c22b79367d9a",
  "assigned_role": "AGT-AI",
  "risk_class": "high",
  "base_commit": "85540d31288c1f3515e3d4b77e63196cb962640e",
  "head_commit": "74b08b200c5de984d231716f1f59227d302afd91",
  "target_ref": "main",
  "target_sha": "85540d31288c1f3515e3d4b77e63196cb962640e",
  "stale_context": false,
  "gate_profile_id": "AI_GATEWAY_P0",
  "gate_profile_digest": "sha256:afd00e18003069ea384a524153feb08b15be7dad74a0d641493bf93653e8694c",
  "gate_result": "passed",
  "gate_stages": [
    {
      "stage": 1,
      "name": "Architecture Fitness & Boundaries",
      "command": [
        "python3",
        "scripts/check_architecture_fitness.py"
      ],
      "cwd": "/Users/hrygo/Documents/wom-worktrees/codex-vf-04b-sealed-evidence",
      "exit_code": 0,
      "status": "passed",
      "started_at": "2026-09-29T16:56:45.876475+00:00",
      "finished_at": "2026-09-29T16:56:45.943813+00:00",
      "raw_log_digest": "sha256:97c7c92686fb5ba1bb59727a3f240f0ec903b65e3464ed3e04e577acc0908627",
      "note": ""
    },
    {
      "stage": 2,
      "name": "AI Gateway & Context Compiler Unit Tests",
      "command": [
        "uv",
        "run",
        "--locked",
        "--extra",
        "dev",
        "pytest",
        "-q",
        "-k",
        "ai or gateway or context or proposal"
      ],
      "cwd": "/Users/hrygo/Documents/wom-worktrees/codex-vf-04b-sealed-evidence/engine",
      "exit_code": 0,
      "status": "passed",
      "started_at": "2026-09-29T16:56:45.943986+00:00",
      "finished_at": "2026-09-29T16:57:20.991179+00:00",
      "raw_log_digest": "sha256:9012a52e9a87a7e70b84c69c24bd1e16a7dfdcac6b6ac623ae3cd88ba1714dd4",
      "note": ""
    }
  ],
  "coverage_gaps": [],
  "scope_audit": {
    "changed_files": [
      "engine/application/speech_unit.py",
      "engine/tests/test_audio_adapter.py",
      "engine/tests/test_audio_prefetch.py",
      "engine/tests/test_post_commit_control.py",
      "engine/tests/test_speech_unit.py",
      "engine/tests/test_voice_runtime.py"
    ],
    "violations": [],
    "escalations": [],
    "privileged_uses": []
  },
  "toolchain": {
    "python": "3.14.7",
    "uv": "uv 0.12.18 (Homebrew 2026-09-22 aarch64-apple-darwin)",
    "swift": "Apple Swift version 6.4 (swiftlang-6.4.0.34.1 clang-2100.3.34.1)",
    "engine_uv_lock_digest": "sha256:fddfb2d7170dd500db490ab633e1aad875fd54881aa80a5b4a4967f4723e3441"
  },
  "runner": {
    "host": "HRYGO-AI-STUDIO",
    "user": "hrygo",
    "role": "AGT-AI",
    "cwd": "/Users/hrygo/Documents/wom-worktrees/codex-vf-04b-sealed-evidence"
  },
  "started_at": "2026-09-29T16:56:45.811092+00:00",
  "finished_at": "2026-09-29T16:57:21.146295+00:00",
  "verdict": "passed",
  "merge_authorizing": false,
  "merge": {},
  "notes": [],
  "integrity": {
    "digest_algorithm": "sha256",
    "statement": "本凭单为可复算摘要记录（digest-recorded receipt），不是密码学签名；其可信度由受保护分支策略、CODEOWNERS 评审与 CI 复算共同保证。"
  }
}
