{
  "receipt_id": "RCP-INTEGRATION-MAC-DIE-PHYSICS-R1-ae26db9f1a60",
  "receipt_type": "integration",
  "task_id": "MAC-DIE-PHYSICS-R1",
  "capsule_id": "CAP-MAC-DIE-PHYSICS-R1",
  "capsule_revision": 1,
  "capsule_digest": "sha256:f353fe8acefa0f262f86749680ef8e576da7c8206d6cb37d557c4129b3c99f44",
  "diff_digest": "sha256:3936f91fffd553029e82670eae88ee933b4938b63c4f0a776ba1f3a637ce9b82",
  "assigned_role": "AGT-MAC",
  "risk_class": "medium",
  "base_commit": "2410d5a4e592f25878c3d10477f7982214192f32",
  "head_commit": "ae26db9f1a60805c8a61f2895e6e9b2d61a4462e",
  "target_ref": "main",
  "target_sha": "ae26db9f1a60805c8a61f2895e6e9b2d61a4462e",
  "stale_context": false,
  "gate_profile_id": "FULL_P0",
  "gate_profile_digest": "sha256:7aee88d64a790cf32dedf224fd100ce4d623c8a92a5f7ee06703783decccfee6",
  "gate_result": "passed",
  "gate_stages": [
    {
      "stage": 1,
      "name": "Architecture Fitness & Boundaries",
      "command": [
        "python3",
        "scripts/check_architecture_fitness.py"
      ],
      "cwd": "/Users/hrygo/Documents/wom-worktrees/feat-die-physics",
      "exit_code": 0,
      "status": "passed",
      "started_at": "2026-09-19T13:20:36.416782+00:00",
      "finished_at": "2026-09-19T13:20:36.455627+00:00",
      "raw_log_digest": "sha256:97c7c92686fb5ba1bb59727a3f240f0ec903b65e3464ed3e04e577acc0908627",
      "note": ""
    },
    {
      "stage": 2,
      "name": "Python Engine & Contracts Test Suite",
      "command": [
        "uv",
        "run",
        "--locked",
        "--extra",
        "dev",
        "pytest",
        "-q"
      ],
      "cwd": "/Users/hrygo/Documents/wom-worktrees/feat-die-physics/engine",
      "exit_code": 0,
      "status": "passed",
      "started_at": "2026-09-19T13:20:36.455718+00:00",
      "finished_at": "2026-09-19T13:21:03.912436+00:00",
      "raw_log_digest": "sha256:b5c9df30d935732e65adfc753dde01ae055433c53848012dbdce913cbb3f7004",
      "note": ""
    },
    {
      "stage": 3,
      "name": "Swift 6 macOS App & Protocol Tests",
      "command": [
        "swift",
        "test",
        "--scratch-path",
        "/Users/hrygo/Documents/wom-worktrees/feat-die-physics/.hacf/spm-scratch"
      ],
      "cwd": "/Users/hrygo/Documents/wom-worktrees/feat-die-physics/macos-app",
      "exit_code": 0,
      "status": "passed",
      "started_at": "2026-09-19T13:21:03.912525+00:00",
      "finished_at": "2026-09-19T13:21:34.353830+00:00",
      "raw_log_digest": "sha256:d3179922e13734d6eee7d46f89eed8deac16f771c6bdc6d5df13ebabc765fee2",
      "note": ""
    },
    {
      "stage": 4,
      "name": "Xcode App Target Build (默认 MainActor 隔离编译验证)",
      "command": [
        "xcodebuild",
        "-project",
        "WorldOfMysteries.xcodeproj",
        "-scheme",
        "WorldOfMysteries",
        "-configuration",
        "Debug",
        "-destination",
        "platform=macOS,arch=arm64",
        "-derivedDataPath",
        "../.hacf/run/xcode-derived",
        "build"
      ],
      "cwd": "/Users/hrygo/Documents/wom-worktrees/feat-die-physics/macos-app",
      "exit_code": 0,
      "status": "passed",
      "started_at": "2026-09-19T13:21:34.353987+00:00",
      "finished_at": "2026-09-19T13:21:38.705815+00:00",
      "raw_log_digest": "sha256:e09a2bbacc80ec0ad2688de9c16efc127fab0e6ed7fb827e4daddacc0ddb84e1",
      "note": ""
    }
  ],
  "coverage_gaps": [],
  "scope_audit": {
    "changed_files": [
      ".agents/capsules/MAC-DIE-PHYSICS-R1.json",
      ".agents/receipts/MAC-DIE-PHYSICS-R1/c0d7444843aa.json",
      "macos-app/WorldOfMysteries/Artifacts/ArtifactFateModels.swift",
      "macos-app/WorldOfMysteries/Artifacts/ArtifactProbabilityDieView.swift",
      "macos-app/WorldOfMysteries/Artifacts/ProbabilityDie/DiePhysics.swift",
      "macos-app/WorldOfMysteries/Artifacts/ProbabilityDie/DieRollPlanner.swift",
      "macos-app/WorldOfMysteries/Artifacts/ProbabilityDie/ProbabilityDiePresenter.swift",
      "macos-app/WorldOfMysteriesTests/ProbabilityDiePhysicsTests.swift"
    ],
    "violations": [],
    "escalations": [],
    "privileged_uses": []
  },
  "toolchain": {
    "python": "3.14.7",
    "uv": "uv 0.12.17 (Homebrew 2026-09-18 aarch64-apple-darwin)",
    "swift": "Apple Swift version 6.4 (swiftlang-6.4.0.34.1 clang-2100.3.34.1)",
    "engine_uv_lock_digest": "sha256:fddfb2d7170dd500db490ab633e1aad875fd54881aa80a5b4a4967f4723e3441"
  },
  "runner": {
    "host": "HRYGO-AI-STUDIO",
    "user": "hrygo",
    "role": "AGT-MAC",
    "cwd": "/Users/hrygo/Documents/WorldofMysteries"
  },
  "started_at": "2026-09-19T13:20:36.416583+00:00",
  "finished_at": "2026-09-19T13:22:43.528382+00:00",
  "verdict": "failed",
  "merge_authorizing": false,
  "merge": {
    "strategy": "fast-forward",
    "expected_main_sha": "2410d5a4e592f25878c3d10477f7982214192f32",
    "merged_sha": "ae26db9f1a60805c8a61f2895e6e9b2d61a4462e",
    "cas_verified": true,
    "post_merge_smoke": "failed"
  },
  "notes": [
    "post-merge smoke 未通过：main 已推进，需立即由 AGT-ARB 处置（回滚或前滚修复）。"
  ],
  "integrity": {
    "digest_algorithm": "sha256",
    "statement": "本凭单为可复算摘要记录（digest-recorded receipt），不是密码学签名；其可信度由受保护分支策略、CODEOWNERS 评审与 CI 复算共同保证。"
  }
}
